[
  {
    "id": "LEARNED-F06EE0C9",
    "timestamp": "2025-10-20T19:15:57.210370",
    "contract_name": "VulnerableBank",
    "vulnerability_type": "reentrancy",
    "severity": "critical",
    "description": "Classic reentrancy in withdraw function",
    "affected_code": "\nfunction withdraw(uint256 amount) public {\n    require(balances[msg.sender] >= amount);\n    (bool success, ) = msg.sender.call{value: amount}(\"\");\n    require(success);\n    balances[msg.sender] -= amount;  // State update AFTER external call\n}\n",
    "attack_scenario": "Attacker can recursively call withdraw before balance is updated, draining the contract",
    "detector_pattern": "\\.(call|transfer|send)\\s*\\{.*?\\}\\s*\\(.*?\\);?\\s*\\n.*?=\\s*",
    "fuzzing_invariant": "\n    bool private locked;\n\n    function echidna_no_reentrancy() public returns (bool) {\n        return !locked; // Should never be true during normal execution\n    }\n",
    "slither_detector_code": "\"\"\"\nCustom Slither Detector: reentrancy\nAuto-generated from learned vulnerability: LEARNED-F06EE0C9\n\"\"\"\n\nfrom slither.detectors.abstract_detector import AbstractDetector, DetectorClassification\n\n\nclass reentrancyDetector(AbstractDetector):\n    \"\"\"\n    Detects: Classic reentrancy in withdraw function\n\n    Learned from: VulnerableBank\n    Date: 2025-10-20T19:15:57.210341\n    \"\"\"\n\n    ARGUMENT = \"reentrancy\"\n    HELP = \"Classic reentrancy in withdraw function\"\n    IMPACT = DetectorClassification.CRITICAL\n    CONFIDENCE = DetectorClassification.HIGH\n\n    WIKI = \"https://github.com/crytic/slither/wiki/Detector-Documentation\"\n    WIKI_TITLE = \"reentrancy\"\n    WIKI_DESCRIPTION = \"Classic reentrancy in withdraw function\"\n    WIKI_EXPLOIT_SCENARIO = \"\"\"\n```solidity\n\nfunction withdraw(uint256 amount) public {\n    require(balances[msg.sender] >= amount);\n    (bool success, ) = msg.sender.call{value: amount}(\"\");\n    require(success);\n    balances[msg.sender] -= amount;  // State update AFTER external call\n}\n\n```\n\nAttack scenario:\nAttacker can recursively call withdraw before balance is updated, draining the contract\n\"\"\"\n\n    WIKI_RECOMMENDATION = \"Review the identified code pattern and apply appropriate mitigations.\"\n\n    def _detect(self):\n        \"\"\"Detect the vulnerability pattern\"\"\"\n        results = []\n\n        for contract in self.compilation_unit.contracts_derived:\n            for function in contract.functions:\n                # TODO: Implement detection logic based on pattern:\n                # \\.(call|transfer|send)\\s*\\{.*?\\}\\s*\\(.*?\\);?\\s*\\n.*?=\\s*\n\n                # Placeholder detection\n                if self._matches_pattern(function):\n                    info = [function, \" matches vulnerability pattern\\n\"]\n                    res = self.generate_result(info)\n                    results.append(res)\n\n        return results\n\n    def _matches_pattern(self, function):\n        \"\"\"Check if function matches the vulnerability pattern\"\"\"\n        # Implement pattern matching logic here\n        # For now, return False\n        return False\n",
    "llm_prompt_addition": "\nWhen analyzing contracts, specifically look for:\n- Type: reentrancy\n- Pattern: Classic reentrancy in withdraw function\n- Example affected code:\n  ```\n  \nfunction withdraw(uint256 amount) public {\n    require(balances[msg.sender] >= amount);\n    (bool success, ) = msg.sender.call{value: amount}(\"\");\n    require(success);\n    balances[msg.sender] -= amount;  // State update AFTER external call\n}\n\n  ```\n- Attack scenario: Attacker can recursively call withdraw before balance is updated, draining the contract\n"
  },
  {
    "id": "LEARNED-424D7BF1",
    "timestamp": "2025-10-20T19:15:57.211971",
    "contract_name": "DeFiProtocol",
    "vulnerability_type": "oracle_manipulation",
    "severity": "high",
    "description": "Oracle price used without staleness check",
    "affected_code": "\nfunction getPrice() public view returns (uint256) {\n    (, int256 price, , ,) = priceFeed.latestRoundData();\n    return uint256(price);  // No timestamp check!\n}\n",
    "attack_scenario": "Attacker can exploit stale oracle prices during network issues or oracle downtime",
    "detector_pattern": "latestAnswer\\(\\)|latestRoundData\\(\\)",
    "fuzzing_invariant": "\n    function echidna_custom_invariant() public view returns (bool) {\n        // Auto-generated invariant for: Oracle price used without staleness check\n        // TODO: Implement specific check\n        return true;\n    }\n",
    "slither_detector_code": "\"\"\"\nCustom Slither Detector: oracle_manipulation\nAuto-generated from learned vulnerability: LEARNED-424D7BF1\n\"\"\"\n\nfrom slither.detectors.abstract_detector import AbstractDetector, DetectorClassification\n\n\nclass oracle_manipulationDetector(AbstractDetector):\n    \"\"\"\n    Detects: Oracle price used without staleness check\n\n    Learned from: DeFiProtocol\n    Date: 2025-10-20T19:15:57.211947\n    \"\"\"\n\n    ARGUMENT = \"oracle_manipulation\"\n    HELP = \"Oracle price used without staleness check\"\n    IMPACT = DetectorClassification.HIGH\n    CONFIDENCE = DetectorClassification.HIGH\n\n    WIKI = \"https://github.com/crytic/slither/wiki/Detector-Documentation\"\n    WIKI_TITLE = \"oracle_manipulation\"\n    WIKI_DESCRIPTION = \"Oracle price used without staleness check\"\n    WIKI_EXPLOIT_SCENARIO = \"\"\"\n```solidity\n\nfunction getPrice() public view returns (uint256) {\n    (, int256 price, , ,) = priceFeed.latestRoundData();\n    return uint256(price);  // No timestamp check!\n}\n\n```\n\nAttack scenario:\nAttacker can exploit stale oracle prices during network issues or oracle downtime\n\"\"\"\n\n    WIKI_RECOMMENDATION = \"Review the identified code pattern and apply appropriate mitigations.\"\n\n    def _detect(self):\n        \"\"\"Detect the vulnerability pattern\"\"\"\n        results = []\n\n        for contract in self.compilation_unit.contracts_derived:\n            for function in contract.functions:\n                # TODO: Implement detection logic based on pattern:\n                # latestAnswer\\(\\)|latestRoundData\\(\\)\n\n                # Placeholder detection\n                if self._matches_pattern(function):\n                    info = [function, \" matches vulnerability pattern\\n\"]\n                    res = self.generate_result(info)\n                    results.append(res)\n\n        return results\n\n    def _matches_pattern(self, function):\n        \"\"\"Check if function matches the vulnerability pattern\"\"\"\n        # Implement pattern matching logic here\n        # For now, return False\n        return False\n",
    "llm_prompt_addition": "\nWhen analyzing contracts, specifically look for:\n- Type: oracle_manipulation\n- Pattern: Oracle price used without staleness check\n- Example affected code:\n  ```\n  \nfunction getPrice() public view returns (uint256) {\n    (, int256 price, , ,) = priceFeed.latestRoundData();\n    return uint256(price);  // No timestamp check!\n}\n\n  ```\n- Attack scenario: Attacker can exploit stale oracle prices during network issues or oracle downtime\n"
  }
]